<?xml version="1.0"?>
<!--
  Copyright (c) 2015 Aalto University.

  Licensed under the 4-clause BSD (the "License");
  you may not use this file except in compliance with the License.
  You may obtain a copy of the License at top most directory of project.

  Unless required by applicable law or agreed to in writing, software
  distributed under the License is distributed on an "AS IS" BASIS,
  WITHOUT WARRANTIES OR CONDITIONS OF ANY KIND, either express or implied.
  See the License for the specific language governing permissions and
  limitations under the License.
-->
<Objects xmlns:xs="http://www.w3.org/2001/XMLSchema-instance" xmlns="http://www.opengroup.org/xsd/odf/1.0/" xs:schemaLocation="odf.xsd odf.xsd">
  <Object>
    <id>SmartHouse</id>
    <InfoItem name="FrontDoor">
      <value>1</value>
    </InfoItem>
    <InfoItem name="BackDoor">
      <value>1</value>
    </InfoItem>
    <Object>
      <id>Kitchen</id>
      <InfoItem name="Temperature">
        <MetaData>
          <InfoItem name="Latency">
            <value type="xs:double">2.3</value>
          </InfoItem>
          <InfoItem name="Accuracy">
            <value type="xs:double">0.05</value>
          </InfoItem>
        </MetaData>
        <value>22.3</value>
      </InfoItem>
      <InfoItem name="Moisture">
        <MetaData>
          <InfoItem name="Latency">
            <value type="xs:double">2.3</value>
          </InfoItem>
          <InfoItem name="Accuracy">
            <value type="xs:double">0.5</value>
          </InfoItem>
        </MetaData>
        <value>50.5</value>
      </InfoItem>
      <Object>
          <id>Oven</id>
          <InfoItem name="Temperature">
              <MetaData>
                  <InfoItem name="Latency">
                      <value type="xs:double">2.3</value>
                  </InfoItem>
                  <InfoItem name="Accuracy">
                      <value type="xs:double">0.05</value>
                  </InfoItem>
              </MetaData>
              <value>22.3</value>
          </InfoItem>
          <InfoItem name="Consumption">
              <MetaData>
                  <InfoItem name="Latency">
                      <value type="xs:double">2.3</value>
                  </InfoItem>
                  <InfoItem name="Accuracy">
                      <value type="xs:double">0.5</value>
                  </InfoItem>
              </MetaData>
              <value>50.5</value>
          </InfoItem>
      </Object>
    </Object>
    <Object>
      <id>BedRoom</id>
      <InfoItem name="Temperature">
        <MetaData>
          <InfoItem name="Latency">
            <value type="xs:double">2.3</value>
          </InfoItem>
          <InfoItem name="Accuracy">
            <value type="xs:double">0.05</value>
          </InfoItem>
        </MetaData>
        <value>22.3</value>
      </InfoItem>
      <InfoItem name="Moisture">
        <MetaData>
          <InfoItem name="Latency">
            <value type="xs:double">2.3</value>
          </InfoItem>
          <InfoItem name="Accuracy">
            <value type="xs:double">0.5</value>
          </InfoItem>
        </MetaData>
        <value>50.5</value>
      </InfoItem>
    </Object>
  </Object>
</Objects>
