<?xml version="1.0" encoding="UTF-8"?>
<Objects xmlns:xs="http://www.w3.org/2001/XMLSchema-instance" xmlns="odf.xsd" xs:schemaLocation="odf.xsd odf.xsd">
    <Object>
	<id>SmartHouse</id>
	<InfoItem name="PowerConsumption">
	    <value dateTime="2014-12-18T15:34:52">180</value>
	</InfoItem>
	<InfoItem name="Moisture">
	    <value unixTime="1418916892">0.20</value>
	</InfoItem>
	<Object>
	    <id>SmartFridge</id>
	    <InfoItem name="PowerConsumption">
		<value>56</value>
	    </InfoItem>
	</Object>
	<Object>
	    <id>SmartOven</id>
	    <InfoItem name="PowerOn">
		<value dateTime="2014-12-18T15:34:52">1</value>
	    </InfoItem>
	</Object>
    </Object>
    <Object>
	<id>SmartCar</id>
	<InfoItem name="Fuel">
	    <MetaData>
		<InfoItem name="Units">
		    <value type="xs:String">Litre</value>
		</InfoItem>
	    </MetaData>
	    <value dateTime="2014-12-18T15:34:52">30</value>
	</InfoItem>
    </Object>
    <Object>
	<id>SmartCottage</id>
	<Object>
	    <id>Heater</id>
	</Object>
	<Object>
	    <id>Sauna</id>
	</Object>
	<Object>
	    <id>Weather</id>
	</Object>
    </Object>
</Objects>
